{"protocol":"commonpact","protocol_version":"0.1","profile":"pact-rental","profile_version":"0.1","event_type":"intent.publish","actor":"did:key:z6MkiY8tpGUJ3v59n8ozNxnSn11pVWkPjy9pighh8FoMwWjk","created_at":"2026-07-11T18:00:00Z","expires_at":"2026-07-11T18:10:00Z","previous":[],"payload":{"intent_kind":"asset.available","summary":"Cordless drill available in Queens","matching":{"visibility":"public","coarse_area":"Queens NY"},"profile_payload":{"asset_category":"tool"}},"extensions":{},"critical_extensions":[],"proofs":[{"signer":"did:key:z6MkiY8tpGUJ3v59n8ozNxnSn11pVWkPjy9pighh8FoMwWjk","verification_method":"did:key:z6MkiY8tpGUJ3v59n8ozNxnSn11pVWkPjy9pighh8FoMwWjk#key-1","algorithm":"Ed25519","signature":"EyKneWUOqTNSjCh4sT5AHm-df3ryR7VIVcw_QnXYdYsND6Krd4tEZ2co2YrHUuKbSMAKV90ZCwR7j-8TaoqLBQ"}],"event_id":"sha256:6ebaab627d3e8a8a0e331a2c891a021c717d5f5fd428fb21273681e942bbb490"}
