{"protocol":"commonpact","protocol_version":"0.1","profile":"pact-rental","profile_version":"0.1","event_type":"pact.activate","pact_id":"urn:uuid:11111111-1111-4111-8111-111111111111","actor":"did:key:z6MkiY8tpGUJ3v59n8ozNxnSn11pVWkPjy9pighh8FoMwWjk","created_at":"2026-07-12T14:01:00Z","previous":["sha256:17abc3e80118f4357068fe29da8c692d567289c373214eb78d3c83f53072541f","sha256:592b6d60773d94c77b1c26eb3084efbc86e58b87db71e1d8cbb099119e87d1b3"],"payload":{"agreement_event_ids":["sha256:17abc3e80118f4357068fe29da8c692d567289c373214eb78d3c83f53072541f","sha256:592b6d60773d94c77b1c26eb3084efbc86e58b87db71e1d8cbb099119e87d1b3"],"terms_hash":"sha256:f4a08cd3e74864a070fdc1d060451ddb10bab0375c069ce7856adff8e8469f54","activation_kind":"asset.handoff","activated_at":"2026-07-12T14:00:30Z","evidence":[{"kind":"condition.photo","digest":"sha256:1111111111111111111111111111111111111111111111111111111111111111","media_type":"image/jpeg"}]},"extensions":{},"critical_extensions":[],"proofs":[{"signer":"did:key:z6MkiY8tpGUJ3v59n8ozNxnSn11pVWkPjy9pighh8FoMwWjk","verification_method":"did:key:z6MkiY8tpGUJ3v59n8ozNxnSn11pVWkPjy9pighh8FoMwWjk#key-1","algorithm":"Ed25519","signature":"l8YlyXFqFWLdzaJKdeCnqbB_7JIez9NgsxnV0Y8K-3-4N5-dWQCFv_yBnYDV_QQ-W3Na02r0IIMq6Tl-zm5yAw"},{"signer":"did:key:z6MkjH7ywebsow6iQnbNeZDrbs56VSZCgQirDbacPPv9VHmM","verification_method":"did:key:z6MkjH7ywebsow6iQnbNeZDrbs56VSZCgQirDbacPPv9VHmM#key-1","algorithm":"Ed25519","signature":"rZQsBAseaz634BvB14bXLla3D1TF940gOY06PK2YsnNDrhMstuTqGqFTpnVHmIYyN7xPTtJXguR9sC0xAfO4BQ"}],"event_id":"sha256:dd1f0e26a48c04642def0dd12c83e4ad4723fc8b9978f02dc4d76350deb26c18"}
