{"protocol":"commonpact","protocol_version":"0.1","profile":"pact-rental","profile_version":"0.1","event_type":"pact.accept","pact_id":"urn:uuid:11111111-1111-4111-8111-111111111111","thread_id":"urn:uuid:22222222-2222-4222-8222-222222222222","actor":"did:key:z6MkiY8tpGUJ3v59n8ozNxnSn11pVWkPjy9pighh8FoMwWjk","created_at":"2026-07-11T18:03:00Z","previous":["sha256:200c60668ee8eef3fbc8bda8001031151f7825cbacb14d882e5316d9765da51a"],"payload":{"proposal_event_id":"sha256:200c60668ee8eef3fbc8bda8001031151f7825cbacb14d882e5316d9765da51a","terms_hash":"sha256:f4a08cd3e74864a070fdc1d060451ddb10bab0375c069ce7856adff8e8469f54","role":"owner","accepted_profile_version":"0.1"},"extensions":{},"critical_extensions":[],"proofs":[{"signer":"did:key:z6MkiY8tpGUJ3v59n8ozNxnSn11pVWkPjy9pighh8FoMwWjk","verification_method":"did:key:z6MkiY8tpGUJ3v59n8ozNxnSn11pVWkPjy9pighh8FoMwWjk#key-1","algorithm":"Ed25519","signature":"8-9HlkPZ62-QLCA6oUO3X-8lMPowsJeC6YT3KFlvv6onZmGGCCHK8aw1HNiHn0BQBlCOY9jSTZvywVh7WJllBQ"}],"event_id":"sha256:17abc3e80118f4357068fe29da8c692d567289c373214eb78d3c83f53072541f"}
