{"protocol":"commonpact","protocol_version":"0.1","profile":"pact-rental","profile_version":"0.1","event_type":"pact.completion.receipt","pact_id":"urn:uuid:11111111-1111-4111-8111-111111111111","actor":"did:key:z6MkiY8tpGUJ3v59n8ozNxnSn11pVWkPjy9pighh8FoMwWjk","created_at":"2026-07-13T13:57:00Z","previous":["sha256:37b622d1a9aa22b11d078a3620fdf975037c1638e4f0ae25656b962392cb85d4"],"payload":{"terms_hash":"sha256:f4a08cd3e74864a070fdc1d060451ddb10bab0375c069ce7856adff8e8469f54","activation_event_id":"sha256:dd1f0e26a48c04642def0dd12c83e4ad4723fc8b9978f02dc4d76350deb26c18","claim_event_ids":["sha256:37b622d1a9aa22b11d078a3620fdf975037c1638e4f0ae25656b962392cb85d4"],"outcome":"asset.returned","completed_at":"2026-07-13T13:54:00Z","evidence":[{"kind":"return.photo","digest":"sha256:2222222222222222222222222222222222222222222222222222222222222222","media_type":"image/jpeg"}],"settlement":{"status":"reported_released","provider":"example-escrow","currency":"USD","amount":"50.00"}},"extensions":{},"critical_extensions":[],"proofs":[{"signer":"did:key:z6MkiY8tpGUJ3v59n8ozNxnSn11pVWkPjy9pighh8FoMwWjk","verification_method":"did:key:z6MkiY8tpGUJ3v59n8ozNxnSn11pVWkPjy9pighh8FoMwWjk#key-1","algorithm":"Ed25519","signature":"rNaKOj_K6s2vQ6ylT_IjESgPQBCSnS672ZSb_um1vPjMSG7Na3FDfEUyLyHljfR1v4q_qn2wvt4mb94yCUCjDA"},{"signer":"did:key:z6MkjH7ywebsow6iQnbNeZDrbs56VSZCgQirDbacPPv9VHmM","verification_method":"did:key:z6MkjH7ywebsow6iQnbNeZDrbs56VSZCgQirDbacPPv9VHmM#key-1","algorithm":"Ed25519","signature":"oR1yCRz3oNs31Y07nN3G_-OL8h3e9MGZLRsP9hdEjhBng1Ei8CkeLjHfgtHKMOmZreB62dydFXUsuxceiACIAw"}],"event_id":"sha256:8940e583b10b2a348c17dfa9d3ef5bbb073cc178c56ce3afc4033ee8adc215de"}
