{"protocol":"commonpact","protocol_version":"0.1","profile":"pact-rental","profile_version":"0.1","event_type":"pact.proposal","pact_id":"urn:uuid:11111111-1111-4111-8111-111111111111","thread_id":"urn:uuid:22222222-2222-4222-8222-222222222222","actor":"did:key:z6MkiY8tpGUJ3v59n8ozNxnSn11pVWkPjy9pighh8FoMwWjk","created_at":"2026-07-11T18:02:00Z","expires_at":"2026-07-11T18:08:00Z","previous":["sha256:6ebaab627d3e8a8a0e331a2c891a021c717d5f5fd428fb21273681e942bbb490"],"payload":{"terms":{"profile":"pact-rental","profile_version":"0.1","parties":[{"identity":"did:key:z6MkiY8tpGUJ3v59n8ozNxnSn11pVWkPjy9pighh8FoMwWjk","role":"owner"},{"identity":"did:key:z6MkjH7ywebsow6iQnbNeZDrbs56VSZCgQirDbacPPv9VHmM","role":"renter"}],"obligations":[{"party":"did:key:z6MkiY8tpGUJ3v59n8ozNxnSn11pVWkPjy9pighh8FoMwWjk","code":"provide_asset","description":"Provide the described drill and accessories."},{"party":"did:key:z6MkjH7ywebsow6iQnbNeZDrbs56VSZCgQirDbacPPv9VHmM","code":"return_asset","description":"Return the drill by the agreed deadline."}],"validity":{"starts_at":"2026-07-12T14:00:00Z","ends_at":"2026-07-13T14:00:00Z"},"settlement":{"status":"pending_external","provider":"example-escrow","currency":"USD","amount":"25.00"},"profile_terms":{"asset":{"reference":"asset:fixture:drill-1","category":"tool","condition_summary":"Used, working condition"},"period":{"starts_at":"2026-07-12T14:00:00Z","ends_at":"2026-07-13T14:00:00Z","grace_minutes":30},"handoff":{"method":"in_person","location_class":"private_after_agreement"},"return":{"method":"in_person","deadline":"2026-07-13T14:00:00Z","location_class":"private_after_agreement"},"price":{"currency":"USD","amount":"25.00","provider":"example-processor"},"deposit":{"required":true,"currency":"USD","amount":"50.00","provider":"example-escrow","release_conditions":["bilateral_return_receipt"]},"permitted_use":["household_repair"],"obligations":["keep_dry","return_battery_and_charger"],"cancellation":{"before_handoff":"full_refund_reported"},"condition_evidence":{"method":"photo_hashes","retention_days":90},"accessibility":{"instruction_format":"text_and_audio"}},"agreement_extensions":{}},"terms_hash":"sha256:f4a08cd3e74864a070fdc1d060451ddb10bab0375c069ce7856adff8e8469f54","proposal_expires_at":"2026-07-11T18:08:00Z"},"extensions":{},"critical_extensions":[],"proofs":[{"signer":"did:key:z6MkiY8tpGUJ3v59n8ozNxnSn11pVWkPjy9pighh8FoMwWjk","verification_method":"did:key:z6MkiY8tpGUJ3v59n8ozNxnSn11pVWkPjy9pighh8FoMwWjk#key-1","algorithm":"Ed25519","signature":"BJxcZxWvGcFyBGUZHcoxoVksote13y8Q8LZPxuxaKWBOAQ5CCRn4dO_xsisQegw24XUkXaRQQsRQrxOVPbTbAQ"}],"event_id":"sha256:200c60668ee8eef3fbc8bda8001031151f7825cbacb14d882e5316d9765da51a"}
