{"protocol":"commonpact","protocol_version":"0.1","profile":"pact-rental","profile_version":"0.1","event_type":"pact.accept","pact_id":"urn:uuid:11111111-1111-4111-8111-111111111111","thread_id":"urn:uuid:22222222-2222-4222-8222-222222222222","actor":"did:key:z6MkjH7ywebsow6iQnbNeZDrbs56VSZCgQirDbacPPv9VHmM","created_at":"2026-07-11T18:03:10Z","previous":["sha256:200c60668ee8eef3fbc8bda8001031151f7825cbacb14d882e5316d9765da51a"],"payload":{"proposal_event_id":"sha256:200c60668ee8eef3fbc8bda8001031151f7825cbacb14d882e5316d9765da51a","terms_hash":"sha256:f4a08cd3e74864a070fdc1d060451ddb10bab0375c069ce7856adff8e8469f54","role":"renter","accepted_profile_version":"0.1"},"extensions":{},"critical_extensions":[],"proofs":[{"signer":"did:key:z6MkjH7ywebsow6iQnbNeZDrbs56VSZCgQirDbacPPv9VHmM","verification_method":"did:key:z6MkjH7ywebsow6iQnbNeZDrbs56VSZCgQirDbacPPv9VHmM#key-1","algorithm":"Ed25519","signature":"q6Ri_7GhQU0QJRJDsKYPfDhLb_yKbkrNURec_at4R5q_FnoDg99fcXUA-54sdMxx9FYRdjbNAlgmS64l_2LpCg"}],"event_id":"sha256:592b6d60773d94c77b1c26eb3084efbc86e58b87db71e1d8cbb099119e87d1b3"}
